{
  "schema_version": 1,
  "generated_at": "2026-02-16T00:00:00Z",
  "repository_root": ".",
  "schema_path": "tasks/schemas/m21-scaffold-merge-remove-decision-matrix.schema.json",
  "policy_path": "tasks/policies/scaffold-merge-remove-rubric.json",
  "policy_id": "scaffold-merge-remove-rubric",
  "weights": {
    "operator_value": 3,
    "runtime_usage": 3,
    "maintenance_cost": 2,
    "test_posture": 2
  },
  "thresholds": {
    "remove_max_score": 18,
    "keep_min_score": 19,
    "keep_max_score": 35,
    "merge_min_score": 36
  },
  "summary": {
    "total_candidates": 13,
    "keep_count": 8,
    "merge_count": 1,
    "remove_count": 4,
    "unresolved_count": 0
  },
  "candidates": [
    {
      "candidate_id": "tau-algorithm",
      "surface": "crate:tau-algorithm",
      "owner": "training-runtime",
      "action": "keep",
      "merge_target": null,
      "weighted_score": 35,
      "scores": {
        "operator_value": 4,
        "runtime_usage": 3,
        "maintenance_cost": 2,
        "test_posture": 4
      },
      "rationale": "Algorithm strategy layer is independently testable and should remain decoupled from runtime plumbing."
    },
    {
      "candidate_id": "tau-browser-automation",
      "surface": "crate:tau-browser-automation",
      "owner": "tools-runtime",
      "action": "remove",
      "merge_target": null,
      "weighted_score": 17,
      "scores": {
        "operator_value": 2,
        "runtime_usage": 1,
        "maintenance_cost": 4,
        "test_posture": 3
      },
      "rationale": "Contract-only browser scaffolding remains low-usage and high-maintenance without live automation hooks."
    },
    {
      "candidate_id": "tau-contract-runner-remnants",
      "surface": "contract-runner remnant paths across retained crates",
      "owner": "runtime-core",
      "action": "remove",
      "merge_target": null,
      "weighted_score": 7,
      "scores": {
        "operator_value": 1,
        "runtime_usage": 0,
        "maintenance_cost": 4,
        "test_posture": 1
      },
      "rationale": "No operator-facing value and no active runtime usage; dead remnant maintenance burden is unjustified."
    },
    {
      "candidate_id": "tau-custom-command",
      "surface": "crate:tau-custom-command",
      "owner": "events-runtime",
      "action": "keep",
      "merge_target": null,
      "weighted_score": 25,
      "scores": {
        "operator_value": 3,
        "runtime_usage": 2,
        "maintenance_cost": 3,
        "test_posture": 3
      },
      "rationale": "Custom command contracts provide operator value but are not yet high-frequency runtime paths."
    },
    {
      "candidate_id": "tau-dashboard-widget-contracts",
      "surface": "crate:tau-dashboard (contract widgets)",
      "owner": "gateway-ui",
      "action": "merge",
      "merge_target": "tau-dashboard",
      "weighted_score": 37,
      "scores": {
        "operator_value": 5,
        "runtime_usage": 4,
        "maintenance_cost": 4,
        "test_posture": 4
      },
      "rationale": "Widget contracts and runtime shell should converge into one maintained dashboard ownership boundary."
    },
    {
      "candidate_id": "tau-memory-postgres-backend",
      "surface": "crate:tau-memory (postgres fixture backend)",
      "owner": "memory-runtime",
      "action": "remove",
      "merge_target": null,
      "weighted_score": 13,
      "scores": {
        "operator_value": 2,
        "runtime_usage": 1,
        "maintenance_cost": 4,
        "test_posture": 1
      },
      "rationale": "Postgres path is scaffold-level and duplicates active memory ownership in retained runtime surfaces."
    },
    {
      "candidate_id": "tau-trainer",
      "surface": "crate:tau-trainer",
      "owner": "training-runtime",
      "action": "keep",
      "merge_target": null,
      "weighted_score": 35,
      "scores": {
        "operator_value": 4,
        "runtime_usage": 3,
        "maintenance_cost": 2,
        "test_posture": 4
      },
      "rationale": "Top-level trainer lifecycle remains stable and easier to evolve as a focused crate boundary."
    },
    {
      "candidate_id": "tau-training-proxy",
      "surface": "crate:tau-training-proxy",
      "owner": "training-runtime",
      "action": "keep",
      "merge_target": null,
      "weighted_score": 25,
      "scores": {
        "operator_value": 3,
        "runtime_usage": 2,
        "maintenance_cost": 3,
        "test_posture": 3
      },
      "rationale": "Proxy surface is optional and should remain isolated until live usage justifies deeper consolidation."
    },
    {
      "candidate_id": "tau-training-runner",
      "surface": "crate:tau-training-runner",
      "owner": "training-runtime",
      "action": "keep",
      "merge_target": null,
      "weighted_score": 35,
      "scores": {
        "operator_value": 4,
        "runtime_usage": 3,
        "maintenance_cost": 2,
        "test_posture": 4
      },
      "rationale": "Runner orchestration remains a clean runtime boundary with active test coverage."
    },
    {
      "candidate_id": "tau-training-store",
      "surface": "crate:tau-training-store",
      "owner": "training-runtime",
      "action": "keep",
      "merge_target": null,
      "weighted_score": 35,
      "scores": {
        "operator_value": 4,
        "runtime_usage": 3,
        "maintenance_cost": 2,
        "test_posture": 4
      },
      "rationale": "Store ownership is explicit and reused by runner/tracer/trainer orchestration flows."
    },
    {
      "candidate_id": "tau-training-tracer",
      "surface": "crate:tau-training-tracer",
      "owner": "training-runtime",
      "action": "keep",
      "merge_target": null,
      "weighted_score": 33,
      "scores": {
        "operator_value": 4,
        "runtime_usage": 3,
        "maintenance_cost": 2,
        "test_posture": 3
      },
      "rationale": "Tracer boundary is actively used and independently testable from runner/store concerns."
    },
    {
      "candidate_id": "tau-training-types",
      "surface": "crate:tau-training-types",
      "owner": "training-runtime",
      "action": "keep",
      "merge_target": null,
      "weighted_score": 35,
      "scores": {
        "operator_value": 4,
        "runtime_usage": 3,
        "maintenance_cost": 2,
        "test_posture": 4
      },
      "rationale": "Shared training type boundary remains stable and keeps compile-time dependencies acyclic."
    },
    {
      "candidate_id": "tau-voice-runtime",
      "surface": "crate:tau-voice",
      "owner": "multi-channel-runtime",
      "action": "remove",
      "merge_target": null,
      "weighted_score": 15,
      "scores": {
        "operator_value": 2,
        "runtime_usage": 1,
        "maintenance_cost": 4,
        "test_posture": 2
      },
      "rationale": "Voice contracts are present but live speech pipeline is not yet in retained production flows."
    }
  ]
}
